{
  "schemaVersion": "vela.webhook.v1",
  "id": "evt_merge_queued_01",
  "type": "merge.queued",
  "created_at": "2026-05-06T11:10:00Z",
  "data": {
    "organization_id": "org_01",
    "repository_id": "repo_01",
    "pull_request_id": "pr_01",
    "merge_candidate_id": "mc_01",
    "base_sha": "1111111111111111111111111111111111111111",
    "head_sha": "2222222222222222222222222222222222222222",
    "queued_by_actor_id": "actor_01"
  }
}
