{
  "schemaVersion": "vela.webhook.v1",
  "id": "evt_pr_comment_created_01",
  "type": "pr.comment.created",
  "created_at": "2026-05-06T11:05:00Z",
  "data": {
    "organization_id": "org_01",
    "repository_id": "repo_01",
    "pull_request_id": "pr_01",
    "review_id": "review_01",
    "github": {
      "id": 912,
      "html_url": "https://github.example/vela/vela/pull/12#discussion_r912"
    }
  }
}
