{
  "schemaVersion": "vela.webhook.v1",
  "id": "evt_repo_import_queued_01",
  "type": "repo.import_queued",
  "created_at": "2026-05-06T11:00:00Z",
  "data": {
    "organization_id": "org_01",
    "repository_id": "repo_01",
    "job_id": 42,
    "job_kind": "repo_import",
    "queue": "default",
    "actor_id": "actor_01",
    "resource_id": "repo_01"
  }
}
